{
  "$schema": "https://raw.githubusercontent.com/srnoob2570/ollama-cloud-catalog/main/schemas/pricing.schema.json",
  "generated_at": "2026-10-19T14:40:12.882Z",
  "models": {
    "clef:27b": {
      "cache_read": 0,
      "input": 0.24,
      "output": 0
    },
    "deepseek-v4-pro:0813": {
      "cache_read": 0.044,
      "input": 1.32,
      "output": 3.96
    },
    "deepseek-v4.1-flash": {
      "cache_read": 0.006,
      "input": 0.3,
      "output": 1.2
    },
    "deepseek-v4.1-flash:1017": {
      "cache_read": 0.006,
      "input": 0.3,
      "output": 1.2
    },
    "gemma4:31b": {
      "cache_read": 0.05,
      "input": 0.14,
      "output": 0.4
    },
    "glm-5.2": {
      "cache_read": 0.26,
      "input": 1.4,
      "output": 4.4
    },
    "glm-5.3": {
      "cache_read": 0.26,
      "input": 1.4,
      "output": 4.4
    },
    "glm-5.3-flash": {
      "cache_read": 0.03,
      "input": 0.15,
      "output": 0.5
    },
    "gpt-oss:120b": {
      "cache_read": 0.014,
      "input": 0.15,
      "output": 0.6
    },
    "gpt-oss:20b": {
      "cache_read": 0.035,
      "input": 0.07,
      "output": 0.3
    },
    "kimi-k2.6": {
      "cache_read": 0.16,
      "input": 0.95,
      "output": 4
    },
    "kimi-k2.7-code": {
      "cache_read": 0.19,
      "input": 0.95,
      "output": 4
    },
    "kimi-k3": {
      "cache_read": 0.3,
      "input": 3,
      "output": 15
    },
    "minimax-m2.7": {
      "cache_read": 0.06,
      "input": 0.3,
      "output": 1.2
    },
    "minimax-m3": {
      "cache_read": 0.12,
      "input": 0.6,
      "output": 2.4
    },
    "minimax-m3.1-flash": {
      "cache_read": 0.015,
      "input": 0.15,
      "output": 0.6
    },
    "mistral-large-3:675b": {
      "input": 0.5,
      "output": 1.5
    },
    "mistral-large-4": {
      "cache_read": 0.07,
      "input": 0.68,
      "output": 2.09
    },
    "muse-spark-open": {
      "cache_read": 0.15,
      "input": 1.25,
      "output": 4.25
    },
    "nemotron-3-nano:30b": {
      "input": 0.06,
      "output": 0.24
    },
    "nemotron-3-super": {
      "cache_read": 0.015,
      "input": 0.015,
      "output": 0.6
    },
    "nemotron-3-ultra": {
      "cache_read": 0.1,
      "input": 0.1,
      "output": 3
    }
  },
  "provider": "ollama-cloud",
  "source": "https://ollama.com/pricing",
  "x_ollama": {
    "off_peak_models": {
      "deepseek-v4-pro:0813": {
        "cache_read": 0.022,
        "input": 0.66,
        "output": 1.98
      },
      "deepseek-v4.1-flash": {
        "cache_read": 0.003,
        "input": 0.15,
        "output": 0.6
      },
      "deepseek-v4.1-flash:1017": {
        "cache_read": 0.003,
        "input": 0.15,
        "output": 0.6
      }
    },
    "off_peak_window": "Off-peak pricing apply outside 12:00 and 18:00 UTC on weekdays and all day on weekends."
  }
}
